{
	"lastUpdated": "2026-10-24",
	"source": "CLDT Seasonal Trail Status",
	"sourceUrl": "https://cldt.hr",
	"entries": [
		{
			"id": "medvednica-bikcevic-fallen-tree-2026",
			"severity": "caution",
			"season": "shoulder",
			"distanceStartKm": 788,
			"distanceEndKm": 796,
			"validFrom": "2026-10-24",
			"validUntil": "2026-11-07",
			"note_hr": "Na Bikčevićevoj stazi, oko 300 metara od donjeg početka nalazi se prepreka - srušeno stablo preko uskog dijela puta uz strminu.",
			"note_en": "On the Bikčević trail, about 300 metres from the lower start, there is an obstacle - a fallen tree across a narrow section of the path along a steep slope.",
			"source": "HPS - Planinarski putovi (vijesti)",
			"sourceUrl": "https://www.hps.hr/novosti/planinarski-putovi/",
			"lastUpdated": "2026-10-24"
		},
		{
			"id": "sjeverni-velebit-zavizan-road-2026",
			"severity": "caution",
			"season": "shoulder",
			"distanceStartKm": 1576,
			"distanceEndKm": 1582,
			"validFrom": "2026-10-24",
			"validUntil": "2026-11-07",
			"note_hr": "Cesta Babić Siča - Zavižan otvorena je za promet samo od petka do nedjelje, ostalim danima je zatvorena.",
			"note_en": "The Babić Siča - Zavižan road is open to traffic only from Friday to Sunday and is closed on other days.",
			"source": "NP Sjeverni Velebit - Važne obavijesti",
			"sourceUrl": "https://np-sjeverni-velebit.hr/www/hr/va%C5%BEne-obavijesti",
			"lastUpdated": "2026-10-24"
		}
	]
}
